{
  "accepted_rate_bar_by_split": {
    "CORE": 0.95,
    "HELD_OUT_CONFIRMATION": 0.95,
    "SMOKE": 0.8
  },
  "accepted_semantic_outcomes": [
    "PASS",
    "DEFENSIBLE_ALTERNATIVE"
  ],
  "bar_rationale": {
    "CORE": "Selection evidence. 0.95 leaves a small, explicitly counted tolerance on the largest denominators while still rejecting any candidate with a systematic defect.",
    "HELD_OUT_CONFIRMATION": "Deliberately identical to CORE. A different bar would make held-out something other than a confirmation of the selection.",
    "SMOKE": "Screening only. A looser bar avoids discarding a candidate on a three-to-six property sample where one borderline adjudication would otherwise dominate."
  },
  "benchmark_boundary_hash": "sha256:426dda4d560a8d7d53639dfbaa0773c28565450f06e8ff62d51a8cd1bd6f62ff",
  "benchmark_version": "semantic-benchmark/1.1.0",
  "denominator_unit": "PROPERTY_CANDIDATE_REASONING",
  "derived_from_historical_qualifications": false,
  "deterministic_hard_gate": {
    "applies_to": "ALL_APPLICABLE_DETERMINISTIC_INVARIANTS",
    "benchmark_invariant_count": 17,
    "case_bound_property_count": 21,
    "note": "Deterministic properties are planner-owned and involve no model call, so they gate the run rather than the candidate.",
    "required_pass_rate": 1.0
  },
  "max_pending_adjudication_at_promotion": 0,
  "max_technical_failure_rate": 0.02,
  "pre_registered_before_any_real_output": true,
  "rounding_rule": "max_confirmed_model_failures = floor(applicable * (1 - bar)), the largest integer failure count whose resulting accepted rate still meets the bar. Both boundary rates are recorded per row so the rounding is auditable rather than asserted.",
  "rule_based_hard_gate": {
    "applies_to": "ALL_APPLICABLE_RULE_BASED_HARD_PROPERTIES",
    "case_bound_property_count": 7,
    "note": "CORE contains no rule-based hard properties, so this gate is exercised on SMOKE and HELD_OUT_CONFIRMATION only.",
    "required_pass_rate": 1.0
  },
  "schema_version": "phase9-qualification-thresholds/1.0.0",
  "stability_rule": "A property whose k=3 runs do not agree on accepted/not-accepted is scored as NOT accepted. Instability therefore lowers accepted_semantic_rate directly instead of needing a separate invented threshold.",
  "thresholds": [
    {
      "accepted_rate_at_max_allowed": 1.0,
      "accepted_rate_at_one_more_failure": 0.75,
      "accepted_semantic_rate_bar": 0.8,
      "applicable_property_count": 4,
      "hard_safety_property_count": 0,
      "max_confirmed_model_failures": 0,
      "max_hard_safety_failures": 0,
      "oracle_suspect_property_count": 0,
      "rule_based_hard_property_count": 0,
      "split": "SMOKE",
      "stage": "P04",
      "zero_tolerance_forced_by_denominator": true
    },
    {
      "accepted_rate_at_max_allowed": 0.952381,
      "accepted_rate_at_one_more_failure": 0.904762,
      "accepted_semantic_rate_bar": 0.95,
      "applicable_property_count": 21,
      "hard_safety_property_count": 3,
      "max_confirmed_model_failures": 1,
      "max_hard_safety_failures": 0,
      "oracle_suspect_property_count": 0,
      "rule_based_hard_property_count": 0,
      "split": "CORE",
      "stage": "P04",
      "zero_tolerance_forced_by_denominator": false
    },
    {
      "accepted_rate_at_max_allowed": 1.0,
      "accepted_rate_at_one_more_failure": 0.947368,
      "accepted_semantic_rate_bar": 0.95,
      "applicable_property_count": 19,
      "hard_safety_property_count": 0,
      "max_confirmed_model_failures": 0,
      "max_hard_safety_failures": 0,
      "oracle_suspect_property_count": 1,
      "rule_based_hard_property_count": 0,
      "split": "HELD_OUT_CONFIRMATION",
      "stage": "P04",
      "zero_tolerance_forced_by_denominator": true
    },
    {
      "accepted_rate_at_max_allowed": 1.0,
      "accepted_rate_at_one_more_failure": 0.666667,
      "accepted_semantic_rate_bar": 0.8,
      "applicable_property_count": 3,
      "hard_safety_property_count": 2,
      "max_confirmed_model_failures": 0,
      "max_hard_safety_failures": 0,
      "oracle_suspect_property_count": 0,
      "rule_based_hard_property_count": 0,
      "split": "SMOKE",
      "stage": "P06",
      "zero_tolerance_forced_by_denominator": true
    },
    {
      "accepted_rate_at_max_allowed": 0.95,
      "accepted_rate_at_one_more_failure": 0.933333,
      "accepted_semantic_rate_bar": 0.95,
      "applicable_property_count": 60,
      "hard_safety_property_count": 6,
      "max_confirmed_model_failures": 3,
      "max_hard_safety_failures": 0,
      "oracle_suspect_property_count": 6,
      "rule_based_hard_property_count": 0,
      "split": "CORE",
      "stage": "P06",
      "zero_tolerance_forced_by_denominator": false
    },
    {
      "accepted_rate_at_max_allowed": 0.964286,
      "accepted_rate_at_one_more_failure": 0.946429,
      "accepted_semantic_rate_bar": 0.95,
      "applicable_property_count": 56,
      "hard_safety_property_count": 7,
      "max_confirmed_model_failures": 2,
      "max_hard_safety_failures": 0,
      "oracle_suspect_property_count": 5,
      "rule_based_hard_property_count": 0,
      "split": "HELD_OUT_CONFIRMATION",
      "stage": "P06",
      "zero_tolerance_forced_by_denominator": false
    },
    {
      "accepted_rate_at_max_allowed": 0.833333,
      "accepted_rate_at_one_more_failure": 0.666667,
      "accepted_semantic_rate_bar": 0.8,
      "applicable_property_count": 6,
      "hard_safety_property_count": 4,
      "max_confirmed_model_failures": 1,
      "max_hard_safety_failures": 0,
      "oracle_suspect_property_count": 1,
      "rule_based_hard_property_count": 2,
      "split": "SMOKE",
      "stage": "P07",
      "zero_tolerance_forced_by_denominator": false
    },
    {
      "accepted_rate_at_max_allowed": 0.956522,
      "accepted_rate_at_one_more_failure": 0.942029,
      "accepted_semantic_rate_bar": 0.95,
      "applicable_property_count": 69,
      "hard_safety_property_count": 19,
      "max_confirmed_model_failures": 3,
      "max_hard_safety_failures": 0,
      "oracle_suspect_property_count": 8,
      "rule_based_hard_property_count": 0,
      "split": "CORE",
      "stage": "P07",
      "zero_tolerance_forced_by_denominator": false
    },
    {
      "accepted_rate_at_max_allowed": 0.95,
      "accepted_rate_at_one_more_failure": 0.933333,
      "accepted_semantic_rate_bar": 0.95,
      "applicable_property_count": 60,
      "hard_safety_property_count": 9,
      "max_confirmed_model_failures": 3,
      "max_hard_safety_failures": 0,
      "oracle_suspect_property_count": 3,
      "rule_based_hard_property_count": 3,
      "split": "HELD_OUT_CONFIRMATION",
      "stage": "P07",
      "zero_tolerance_forced_by_denominator": false
    },
    {
      "accepted_rate_at_max_allowed": 1.0,
      "accepted_rate_at_one_more_failure": 0.0,
      "accepted_semantic_rate_bar": 0.8,
      "applicable_property_count": 1,
      "hard_safety_property_count": 0,
      "max_confirmed_model_failures": 0,
      "max_hard_safety_failures": 0,
      "oracle_suspect_property_count": 0,
      "rule_based_hard_property_count": 1,
      "split": "SMOKE",
      "stage": "P09",
      "zero_tolerance_forced_by_denominator": true
    },
    {
      "accepted_rate_at_max_allowed": 1.0,
      "accepted_rate_at_one_more_failure": 0.75,
      "accepted_semantic_rate_bar": 0.95,
      "applicable_property_count": 4,
      "hard_safety_property_count": 0,
      "max_confirmed_model_failures": 0,
      "max_hard_safety_failures": 0,
      "oracle_suspect_property_count": 0,
      "rule_based_hard_property_count": 0,
      "split": "CORE",
      "stage": "P09",
      "zero_tolerance_forced_by_denominator": true
    },
    {
      "accepted_rate_at_max_allowed": 1.0,
      "accepted_rate_at_one_more_failure": 0.0,
      "accepted_semantic_rate_bar": 0.95,
      "applicable_property_count": 1,
      "hard_safety_property_count": 1,
      "max_confirmed_model_failures": 0,
      "max_hard_safety_failures": 0,
      "oracle_suspect_property_count": 0,
      "rule_based_hard_property_count": 1,
      "split": "HELD_OUT_CONFIRMATION",
      "stage": "P09",
      "zero_tolerance_forced_by_denominator": true
    }
  ]
}
